{
  "$schema": "../../schema/pathway.schema.json",
  "id": "chlorogenate-to-3-dehydroquinate",
  "name": "chlorogenate to 3-dehydroquinate",
  "category": "energy-metabolism",
  "summary": "A 2-step route from chlorogenate to 3-dehydroquinate, ingested from Rhea. Every step is curated by Rhea and independently verified here to balance in mass and charge.",
  "provenance": {
    "confidence": "high",
    "sources": [
      {
        "db": "Rhea",
        "id": "RHEA:20689"
      },
      {
        "db": "ChEBI",
        "id": "CHEBI:57644"
      }
    ]
  },
  "metabolites": [
    {
      "id": "chlorogenate",
      "name": "chlorogenate",
      "formula": "C16H17O9",
      "charge": -1,
      "xrefs": {
        "chebi": "CHEBI:57644"
      }
    },
    {
      "id": "h2o",
      "name": "Water",
      "formula": "H2O",
      "charge": 0,
      "xrefs": {
        "chebi": "CHEBI:15377"
      }
    },
    {
      "id": "quinate",
      "name": "(−)-quinate",
      "formula": "C7H11O6",
      "charge": -1,
      "xrefs": {
        "chebi": "CHEBI:29751"
      }
    },
    {
      "id": "trans_caffeate",
      "name": "trans-caffeate",
      "formula": "C9H7O4",
      "charge": -1,
      "xrefs": {
        "chebi": "CHEBI:57770"
      }
    },
    {
      "id": "hplus",
      "name": "Proton (H+)",
      "formula": "H",
      "charge": 1,
      "xrefs": {
        "chebi": "CHEBI:15378"
      }
    },
    {
      "id": "nadp",
      "name": "NADP+",
      "formula": "C21H25N7O17P3",
      "charge": -3,
      "xrefs": {
        "chebi": "CHEBI:58349"
      }
    },
    {
      "id": "3_dehydroquinate",
      "name": "3-dehydroquinate",
      "formula": "C7H9O6",
      "charge": -1,
      "xrefs": {
        "chebi": "CHEBI:32364"
      }
    },
    {
      "id": "nadph",
      "name": "NADPH",
      "formula": "C21H26N7O17P3",
      "charge": -4,
      "xrefs": {
        "chebi": "CHEBI:57783"
      }
    },
    {
      "id": "trans_caffeoyl_coa",
      "name": "trans-caffeoyl-CoA",
      "formula": "C30H38N7O19P3S",
      "charge": -4,
      "xrefs": {
        "chebi": "CHEBI:87136"
      }
    },
    {
      "id": "coa",
      "name": "Coenzyme A (CoA-SH)",
      "formula": "C21H32N7O16P3S",
      "charge": -4,
      "xrefs": {
        "chebi": "CHEBI:57287"
      }
    },
    {
      "id": "atp",
      "name": "ATP",
      "formula": "C10H12N5O13P3",
      "charge": -4,
      "xrefs": {
        "chebi": "CHEBI:30616"
      }
    },
    {
      "id": "trans_caffeoyl_amp",
      "name": "trans-caffeoyl-AMP",
      "formula": "C19H19N5O10P",
      "charge": -1,
      "xrefs": {
        "chebi": "CHEBI:192349"
      }
    },
    {
      "id": "ppi",
      "name": "Diphosphate (PPi)",
      "formula": "HO7P2",
      "charge": -3,
      "xrefs": {
        "chebi": "CHEBI:33019"
      }
    }
  ],
  "enzymes": [
    {
      "id": "ec_3_1_1_42",
      "name": "chlorogenate hydrolase",
      "ec": [
        "3.1.1.42"
      ]
    },
    {
      "id": "ec_1_1_1_282",
      "name": "quinate/shikimate dehydrogenase [NAD(P)(+)]",
      "ec": [
        "1.1.1.282"
      ]
    }
  ],
  "reactions": [
    {
      "id": "r1",
      "name": "chlorogenate hydrolase",
      "equation": "chlorogenate + H2O = L-quinate + (E)-caffeate + H(+)",
      "ec": "3.1.1.42",
      "substrates": [
        {
          "metabolite": "chlorogenate",
          "stoichiometry": 1
        },
        {
          "metabolite": "h2o",
          "stoichiometry": 1
        }
      ],
      "products": [
        {
          "metabolite": "quinate",
          "stoichiometry": 1
        },
        {
          "metabolite": "trans_caffeate",
          "stoichiometry": 1
        },
        {
          "metabolite": "hplus",
          "stoichiometry": 1
        }
      ],
      "catalysts": [
        {
          "enzyme": "ec_3_1_1_42"
        }
      ],
      "reversibility": "reversible",
      "pathwayStep": 1,
      "xrefs": {
        "rhea": "RHEA:20689"
      },
      "provenance": {
        "confidence": "high",
        "sources": [
          {
            "db": "Rhea",
            "id": "RHEA:20689"
          }
        ]
      }
    },
    {
      "id": "r2",
      "name": "quinate/shikimate dehydrogenase [NAD(P)(+)]",
      "equation": "L-quinate + NADP(+) = 3-dehydroquinate + NADPH + H(+)",
      "ec": "1.1.1.282",
      "substrates": [
        {
          "metabolite": "quinate",
          "stoichiometry": 1
        },
        {
          "metabolite": "nadp",
          "stoichiometry": 1
        }
      ],
      "products": [
        {
          "metabolite": "3_dehydroquinate",
          "stoichiometry": 1
        },
        {
          "metabolite": "nadph",
          "stoichiometry": 1
        },
        {
          "metabolite": "hplus",
          "stoichiometry": 1
        }
      ],
      "catalysts": [
        {
          "enzyme": "ec_1_1_1_282"
        }
      ],
      "reversibility": "reversible",
      "pathwayStep": 2,
      "xrefs": {
        "rhea": "RHEA:18425"
      },
      "provenance": {
        "confidence": "high",
        "sources": [
          {
            "db": "Rhea",
            "id": "RHEA:18425"
          }
        ]
      }
    },
    {
      "id": "r3",
      "name": "L-quinate + (E)-caffeoyl-CoA = chlorogenate + CoA",
      "equation": "L-quinate + (E)-caffeoyl-CoA = chlorogenate + CoA",
      "substrates": [
        {
          "metabolite": "quinate",
          "stoichiometry": 1
        },
        {
          "metabolite": "trans_caffeoyl_coa",
          "stoichiometry": 1
        }
      ],
      "products": [
        {
          "metabolite": "chlorogenate",
          "stoichiometry": 1
        },
        {
          "metabolite": "coa",
          "stoichiometry": 1
        }
      ],
      "reversibility": "reversible",
      "pathwayStep": 3,
      "xrefs": {
        "rhea": "RHEA:82247"
      },
      "provenance": {
        "confidence": "high",
        "sources": [
          {
            "db": "Rhea",
            "id": "RHEA:82247"
          }
        ]
      }
    },
    {
      "id": "r4",
      "name": "(E)-caffeate + ATP + H(+) = (E)-caffeoyl-AMP + diphosphate",
      "equation": "(E)-caffeate + ATP + H(+) = (E)-caffeoyl-AMP + diphosphate",
      "substrates": [
        {
          "metabolite": "trans_caffeate",
          "stoichiometry": 1
        },
        {
          "metabolite": "atp",
          "stoichiometry": 1
        },
        {
          "metabolite": "hplus",
          "stoichiometry": 1
        }
      ],
      "products": [
        {
          "metabolite": "trans_caffeoyl_amp",
          "stoichiometry": 1
        },
        {
          "metabolite": "ppi",
          "stoichiometry": 1
        }
      ],
      "reversibility": "reversible",
      "pathwayStep": 4,
      "xrefs": {
        "rhea": "RHEA:72431"
      },
      "provenance": {
        "confidence": "high",
        "sources": [
          {
            "db": "Rhea",
            "id": "RHEA:72431"
          }
        ]
      }
    }
  ]
}
